{
  "schema_version": "0.1.0",
  "execution_plan_id": "EP-DU-001",
  "execution_plan_revision": 1,
  "execution_plan_status": "approved",
  "approval_source_ref": "SRC-006",
  "updated_at": "2026-08-03T21:54:53+09:00",
  "delivery_unit_id": "DU-001",
  "work_plan_ref": {
    "path": "delivery-units/DU-001/delivery-work/R1.json",
    "plan_id": "WP-FIN-001",
    "plan_revision": 1,
    "canonical_sha256": "78320c347b4a56cf9e3c85a941b347f8e27d87dff09fed6996f426e1ca42f086"
  },
  "objective_ko": "권한 보유자가 하나 이상의 품목을 제출하고, 성공 여부와 저장된 요청을 자신의 요청 목록에서 다시 확인합니다.",
  "sources": [
    {
      "id": "SRC-001",
      "type": "approved_artifact",
      "captured_at": "2026-08-03T21:39:26+09:00",
      "locator": "delivery-units/DU-001/delivery-work/R1.json#WP-FIN-001@R1",
      "content_ko": "승인된 DU-001 전달 작업 기준선입니다. 작업 21개, 역할 역량, 완료 증거와 선행관계를 실행 계획의 입력으로 고정합니다."
    },
    {
      "id": "SRC-002",
      "type": "user_statement",
      "captured_at": "2026-08-03T21:39:26+09:00",
      "locator": "conversation:2026-08-03:human-ai-execution-model",
      "content_ko": "사용자가 최종 책임자이며, 팀원 A는 기획·와이어프레임·디자인을 담당하고, 상위 AI가 실행을 조율·평가하며 하위 AI 작업자와 독립 검증 AI가 개발을 수행하는 운영 모델을 요청했습니다."
    },
    {
      "id": "SRC-003",
      "type": "repository_evidence",
      "captured_at": "2026-08-03T21:39:26+09:00",
      "locator": "docs/engineering/agent-execution.md;docs/engineering/testing-and-evidence.md",
      "content_ko": "저장소 기준은 작업자별 Git worktree 격리, 선행관계가 충족된 작업만 병렬 착수, 구현자와 검증자 분리, 자동 증거와 사람 승인 게이트를 요구합니다."
    },
    {
      "id": "SRC-004",
      "type": "command_output",
      "captured_at": "2026-08-03T21:39:26+09:00",
      "locator": "command:node --test scripts/validate-execution-plan.test.mjs",
      "content_ko": "실행 계획 검증기의 기준 테스트 7개가 통과해 고정 해시, 작업 전수 배치, 실행자 역량, 롤링 웨이브, 런타임 상태 분리를 검증했습니다."
    },
    {
      "id": "SRC-005",
      "type": "user_statement",
      "captured_at": "2026-08-03T21:50:17+09:00",
      "locator": "conversation:2026-08-03:du-001-execution-policy",
      "content_ko": "제품 책임자는 DU-001을 현재 착수 가능한 작업만 확정하는 롤링 웨이브로 운영하고, 첫 전선에서는 작업량을 추정하지 않으며 실제 처리량을 확인하기 전까지 목표 날짜를 고정하지 않는 추천안을 승인했습니다."
    },
    {
      "id": "SRC-006",
      "type": "user_statement",
      "captured_at": "2026-08-03T21:54:53+09:00",
      "locator": "conversation:2026-08-03:du-001-execution-plan-approval",
      "content_ko": "제품 책임자가 현재 착수 전선 4개, 실행자·독립 검증자 배치, 후속 작업 17개, 추정 없음과 고정 일정 없음 정책을 포함한 DU-001 실행 계획 전체를 명시적으로 승인했습니다."
    }
  ],
  "satisfied_prerequisites": [],
  "planning_policy": {
    "scope_mode": "rolling_wave",
    "estimate_mode": "none",
    "estimate_unit": "not_applicable",
    "schedule_mode": "none",
    "target_window": null,
    "rationale_ko": "처음 검증하는 실행 구조이므로 현재 의존성 시작점만 확정합니다. 첫 전선의 실제 수행 자료로 처리량을 확인하기 전에는 작업량과 날짜를 약속하지 않습니다.",
    "source_refs": ["SRC-001", "SRC-002", "SRC-005"]
  },
  "orchestration": {
    "human_approver_ref": "EXEC:product-owner",
    "coordinator_executor_ref": "EXEC:ai-coordinator",
    "verifier_executor_refs": ["EXEC:ai-verifier"],
    "worker_isolation": "git_worktree",
    "parallelism_mode": "dependency_frontier",
    "max_parallel_workers": null,
    "independent_verification_required": true,
    "rationale_ko": "사람 책임자, AI 총괄, 격리된 전문 작업자와 독립 검증자를 분리합니다. 동시 실행 수는 사용하는 세션의 실제 슬롯을 실행 시점에 확인하므로 기준선에 고정하지 않습니다.",
    "source_refs": ["SRC-002", "SRC-003"]
  },
  "executors": [
    {
      "id": "EXEC:product-owner",
      "kind": "human",
      "display_name": "제품 책임자",
      "execution_roles": ["accountable_owner"],
      "capabilities": [],
      "availability": { "status": "unknown", "capacity_value": null, "capacity_unit": null, "available_from": null, "available_until": null },
      "source_refs": ["SRC-002"]
    },
    {
      "id": "EXEC:design-owner",
      "kind": "human",
      "display_name": "기획·와이어프레임·디자인 담당자",
      "execution_roles": ["worker"],
      "capabilities": ["experience_design"],
      "availability": { "status": "unknown", "capacity_value": null, "capacity_unit": null, "available_from": null, "available_until": null },
      "source_refs": ["SRC-002"]
    },
    {
      "id": "EXEC:ai-coordinator",
      "kind": "ai_agent",
      "display_name": "AI 실행 총괄",
      "execution_roles": ["coordinator"],
      "capabilities": ["technical_design", "quality", "security", "documentation"],
      "availability": { "status": "unknown", "capacity_value": null, "capacity_unit": null, "available_from": null, "available_until": null },
      "source_refs": ["SRC-002", "SRC-003"]
    },
    {
      "id": "EXEC:ai-technical-design",
      "kind": "ai_agent",
      "display_name": "AI 기술 설계 작업자",
      "execution_roles": ["worker"],
      "capabilities": ["technical_design"],
      "availability": { "status": "unknown", "capacity_value": null, "capacity_unit": null, "available_from": null, "available_until": null },
      "source_refs": ["SRC-002", "SRC-003"]
    },
    {
      "id": "EXEC:ai-frontend",
      "kind": "ai_agent",
      "display_name": "AI 프론트엔드 작업자",
      "execution_roles": ["worker"],
      "capabilities": ["frontend"],
      "availability": { "status": "unknown", "capacity_value": null, "capacity_unit": null, "available_from": null, "available_until": null },
      "source_refs": ["SRC-002", "SRC-003"]
    },
    {
      "id": "EXEC:ai-backend",
      "kind": "ai_agent",
      "display_name": "AI 백엔드 작업자",
      "execution_roles": ["worker"],
      "capabilities": ["backend"],
      "availability": { "status": "unknown", "capacity_value": null, "capacity_unit": null, "available_from": null, "available_until": null },
      "source_refs": ["SRC-002", "SRC-003"]
    },
    {
      "id": "EXEC:ai-security-platform",
      "kind": "ai_agent",
      "display_name": "AI 보안·플랫폼 작업자",
      "execution_roles": ["worker"],
      "capabilities": ["security", "platform"],
      "availability": { "status": "unknown", "capacity_value": null, "capacity_unit": null, "available_from": null, "available_until": null },
      "source_refs": ["SRC-002", "SRC-003"]
    },
    {
      "id": "EXEC:ai-verifier",
      "kind": "ai_agent",
      "display_name": "AI 독립 검증자",
      "execution_roles": ["verifier"],
      "capabilities": ["experience_design", "technical_design", "frontend", "backend", "quality", "platform", "security"],
      "availability": { "status": "unknown", "capacity_value": null, "capacity_unit": null, "available_from": null, "available_until": null },
      "source_refs": ["SRC-002", "SRC-003"]
    }
  ],
  "work_allocations": [
    {
      "work_item_ref": "WORK:purchase-request-screen-spec@R1",
      "disposition": "committed",
      "primary_executor_ref": "EXEC:design-owner",
      "collaborator_refs": ["EXEC:ai-verifier"],
      "estimate": { "status": "not_applicable", "low": null, "high": null, "unit": "not_applicable", "basis_ko": null, "source_refs": ["SRC-005"] },
      "target_window": null,
      "rationale_ko": "선행 작업이 없는 현재 착수 전선입니다. 화면 책임자가 기준을 확정하고 독립 AI가 승인 제품 명세와의 일치 여부를 검증합니다.",
      "source_refs": ["SRC-001", "SRC-002", "SRC-003", "SRC-005"]
    },
    {
      "work_item_ref": "WORK:purchase-request-contract-fixtures@R1",
      "disposition": "committed",
      "primary_executor_ref": "EXEC:ai-technical-design",
      "collaborator_refs": ["EXEC:ai-verifier"],
      "estimate": { "status": "not_applicable", "low": null, "high": null, "unit": "not_applicable", "basis_ko": null, "source_refs": ["SRC-005"] },
      "target_window": null,
      "rationale_ko": "선행 작업이 없는 현재 착수 전선입니다. 기술 설계 AI가 계약 예제와 검증 기준선을 만들고 독립 AI가 계약 추적성과 실패 사례를 검증합니다.",
      "source_refs": ["SRC-001", "SRC-002", "SRC-003", "SRC-005"]
    },
    {
      "work_item_ref": "WORK:identity-organization-context@R1",
      "disposition": "committed",
      "primary_executor_ref": "EXEC:ai-security-platform",
      "collaborator_refs": ["EXEC:ai-verifier"],
      "estimate": { "status": "not_applicable", "low": null, "high": null, "unit": "not_applicable", "basis_ko": null, "source_refs": ["SRC-005"] },
      "target_window": null,
      "rationale_ko": "선행 작업이 없는 현재 착수 전선입니다. 보안·플랫폼 AI가 인증과 조직 경계를 구현하고 독립 AI가 교차 조직 격리와 기본 거부를 검증합니다.",
      "source_refs": ["SRC-001", "SRC-002", "SRC-003", "SRC-005"]
    },
    {
      "work_item_ref": "WORK:purchase-request-authorization-rules@R1",
      "disposition": "forecast",
      "primary_executor_ref": null,
      "collaborator_refs": [],
      "estimate": { "status": "unknown", "low": null, "high": null, "unit": "undetermined", "basis_ko": null, "source_refs": [] },
      "target_window": null,
      "rationale_ko": "직접 선행 작업이 완료된 뒤 다음 롤링 웨이브에서 실행자와 검증자를 확정합니다.",
      "source_refs": ["SRC-001"]
    },
    {
      "work_item_ref": "WORK:purchase-request-data-schema@R1",
      "disposition": "committed",
      "primary_executor_ref": "EXEC:ai-backend",
      "collaborator_refs": ["EXEC:ai-verifier"],
      "estimate": { "status": "not_applicable", "low": null, "high": null, "unit": "not_applicable", "basis_ko": null, "source_refs": ["SRC-005"] },
      "target_window": null,
      "rationale_ko": "선행 작업이 없는 현재 착수 전선입니다. 백엔드 AI가 데이터 구조와 마이그레이션을 구현하고 독립 AI가 조직 격리·무결성·되돌리기 가능성을 검증합니다.",
      "source_refs": ["SRC-001", "SRC-002", "SRC-003", "SRC-005"]
    },
    {
      "work_item_ref": "WORK:purchase-request-submission-transaction@R1",
      "disposition": "forecast",
      "primary_executor_ref": null,
      "collaborator_refs": [],
      "estimate": { "status": "unknown", "low": null, "high": null, "unit": "undetermined", "basis_ko": null, "source_refs": [] },
      "target_window": null,
      "rationale_ko": "직접 선행 작업이 완료된 뒤 다음 롤링 웨이브에서 실행자와 검증자를 확정합니다.",
      "source_refs": ["SRC-001"]
    },
    {
      "work_item_ref": "WORK:purchase-request-draft-api@R1",
      "disposition": "forecast",
      "primary_executor_ref": null,
      "collaborator_refs": [],
      "estimate": { "status": "unknown", "low": null, "high": null, "unit": "undetermined", "basis_ko": null, "source_refs": [] },
      "target_window": null,